<?xml version="1.0" encoding="UTF-8"?>
<xs:schema xmlns:xs="http://www.w3.org/2001/XMLSchema">
	<xs:element name="list">
		<xs:complexType>
			<xs:sequence minOccurs="1" maxOccurs="1">
				<xs:element name="teleport" minOccurs="1" maxOccurs="unbounded">
					<xs:complexType>
						<xs:attribute name="id" type="xs:positiveInteger" use="required" />
						<xs:attribute name="loc" type="xs:string" use="required" />
						<xs:attribute name="price" type="xs:long" />
						<xs:attribute name="noobless" type="xs:boolean" />
						<xs:attribute name="itemId" type="xs:integer" />
						<xs:attribute name="minLevel" type="xs:integer" />
						<xs:attribute name="maxLevel" type="xs:integer" />
					</xs:complexType>
				</xs:element>
			</xs:sequence>
		</xs:complexType>
	</xs:element>
</xs:schema>